Date Closed,Ticket Number,Description
2017-01-17T07:44:37Z,769,Combining 2 impact functions derived from 2 different hazards with the same exposure data
2017-01-17T07:14:47Z,768,Impact Functions need to have a consistent impact layer as for the output
2017-01-17T07:37:07Z,761,Reorder detail in InaSAFE report template
2017-01-17T07:11:49Z,727,Display a progress bar while the calculation is running to give feedback to the user
2017-01-17T07:07:24Z,715,refactor deintsect to be a static method
2017-01-27T11:06:47Z,692,Impact function action lists should be refactored into their own class.
2017-01-17T07:07:05Z,680,Nice to have a feedback form on InaSAFE website
2017-01-17T07:06:29Z,671,Impact function parameters dialog needs better documentation
2017-01-17T07:05:31Z,651,Batch Runner to use Configure Impact Function Paramaters
2017-01-17T07:03:03Z,627,Create Script for get the text
2017-01-17T07:01:49Z,597,Implement the Calgary Flood Closures as an impact function
2017-01-17T07:00:59Z,588,Idea for Batch Runner
2017-01-17T07:00:31Z,582,Support slave builds under windows / jenkins
2017-01-17T07:04:25Z,558,"Request for ""Cancel"" button after clicking Run "
2017-01-17T06:59:54Z,552,Building needs building_s and building_l attribute but not exactly explain what the key word for each attribute 
2017-01-18T01:42:32Z,519,Batch runner needs save report option
2017-01-27T10:58:20Z,517,Batch runner should only rerun a script multiple times if a single script is selected
2017-01-17T06:58:07Z,516,Batch runner should always create a new project
2017-01-27T10:57:23Z,515,Batch runner needs to be documented
2017-01-17T06:27:43Z,514,Batch runner should allow user to add currently loaded QGIS state to a scenario file
2017-01-17T06:26:35Z,511,Batch runner should ship with more automation tests
2017-01-17T05:26:58Z,510,Batch runner should generate pdfs into used defined directory
2017-01-17T05:24:55Z,487,Documentation for writing impact functions 
2017-01-17T05:22:59Z,482,New Exposure layers 
2017-01-17T05:22:28Z,457,Impact function for Tornado and Landslide
2017-01-17T05:22:06Z,456,Correct terminology in translations
2017-01-30T14:49:24Z,432,"Ability work with other standards (WCS, WFS, etc.)"
2017-01-17T05:20:44Z,425,Bundle result analysis in one folder 
2017-01-17T05:16:19Z,422,Need more information/documentation on how InaSAFE works per function
2017-01-17T05:13:10Z,418,Constructing an action plan to put into Contingency Plan
2017-01-17T05:11:23Z,416,Impact on roads/bridges/fly-overs and Network Analysis
2017-01-17T05:08:39Z,413,"Buildings structure validated by engineer, vulnerability model"
2017-01-17T05:07:58Z,412,IDP Camps
2017-01-17T05:06:47Z,411,Ability to locate the safe places
2017-01-17T05:04:05Z,407,Python3 compatibility
2017-01-17T05:02:49Z,391,Explaining the different resolution and resampling for hazard and exposure layer in the docs
2017-01-17T05:00:31Z,386,Storage library handling of multipolygons not yet right
2017-01-17T04:59:31Z,379,Full test on Windows takes a very long time
2017-01-17T04:58:38Z,367,Padang project consistently crashes QGIS
2017-01-17T04:54:55Z,275,New QGIS projects
2017-01-17T04:54:29Z,233,We should automatically run tests under windows
2017-01-17T15:57:46Z,210,Communicate the limitations of running with big datasets to users
2017-01-17T04:42:10Z,207,Get ITB building impact function to work with OSM data
2017-01-17T04:56:41Z,198,Use Python's locale module instead of os.environ['LANG']
2017-01-17T04:39:16Z,192,Automatic preprocessing of remote sensing imagery to use as input
2017-01-17T04:34:52Z,190,"Have ""make test"" output more descriptive"
2017-01-17T04:37:35Z,186,We need standardised impact function documentation
2017-01-17T04:32:56Z,164,Rule based symbology
2017-01-17T04:28:10Z,129,Add standard header to all .py files
2017-01-17T04:25:56Z,123,density scaling not working for a native UTM dataset
2017-01-17T04:24:20Z,81,Scenario comparison for different hazard layers
2017-01-17T04:23:13Z,62,Copy relevant issues from Risiko project
2017-01-17T04:20:31Z,23,We need to be able to produce csv's of output data
2017-01-30T14:50:06Z,22,Ability to work with remote data
